"51.99";"Otra operación sobre via biliar ncoc";"";"";"";"";"4";""
"52.01";"Drenaje de quiste pancreatico por cateter";"";"";"";"";"4";""
"52.09";"Otra pancreatotomía";"";"";"";"";"4";""
"52.11";"Biopsia por aspiración [aguja] cerrada de pancreas";"";"";"";"";"4";""
"52.12";"Biopsia abierta de pancreas";"";"";"";"";"4";""
"52.13";"Pancreatografia retrograda endoscopica (erp)";"";"";"";"";"4";""
"52.14";"Biopsia cerrada (endoscopica) de ducto pancreatico";"";"";"";"";"4";""
"52.19";"Otros procedimientos diagnosticos sobre el pancreas";"";"";"";"";"4";""
"52.21";"Escis.endoscop.de destrucc.de lesión o tejido del ducto panc";"";"";"";"";"4";""
"52.22";"Otra escis.o destrucc.de lseion de tej.pancreat.o ducto panc";"";"";"";"";"4";""
"52.30";"Marsupialización de quiste pancreatico";"";"";"";"";"4";""
"52.40";"Drenaje interno de quiste pancreatico";"";"";"";"";"4";""
"52.51";"Pancreatectomía proximal";"";"";"";"";"4";""
"52.52";"Pancreatectomía distal";"";"";"";"";"4";""
"52.53";"Pancreatectomía subtotal radical";"";"";"";"";"4";""
"52.59";"Otra pancreatectomía parcial";"";"";"";"";"4";""
"52.60";"Pancreatectomía total";"";"";"";"";"4";""
"52.70";"Pancreatoduodenectomía radical";"";"";"";"";"4";""
"52.80";"Trasplante de pancreas, n. E. O. M.";"";"";"";"";"4";""
"52.81";"Reimplantación de tejido pancreatico";"";"";"";"";"4";""
"52.82";"Homotrasplante de pancreas";"";"";"";"";"4";""
"52.83";"Heterotrasplante de pancreas";"";"";"";"";"4";""
"52.84";"Autotrasplante de celulas de los islotes de langerhans";"";"";"";"";"4";""
"52.85";"Alotrasplante de celulas de los islotes de langerhans";"";"";"";"";"4";""
"52.86";"Trasplante de celulas de los islotes de langerhans, no espec";"";"";"";"";"4";""
"52.92";"Canulación de conducto pancreatico";"";"";"";"";"4";""
"52.93";"Inserción de sonda en conducto pancreatico";"";"";"";"";"4";""
"52.94";"Extracción endoscopica de calculos del conducto pancreatico";"";"";"";"";"4";""
"52.95";"Otra reparación de pancreas";"";"";"";"";"4";""
"52.96";"Anastomosis de pancreas";"";"";"";"";"4";""
"52.97";"Inserción endoscopica de tubo de drenaje naso pancreatico";"";"";"";"";"4";""
"52.98";"Dilatación endoscopica de ducto pancreatico";"";"";"";"";"4";""
"52.99";"Otra operación sobre pancreas ncoc";"";"";"";"";"4";""
"53.00";"Reparación unilateral de hernia inguinal, n. E. O. M.";"";"";"";"";"4";""
"53.01";"Reparación de hernia inguinal directa";"";"";"";"";"4";""
"53.02";"Reparación de hernia inguinal indirecta";"";"";"";"";"4";""
"53.03";"Reparación de hernia inguinal directa con injerto o prótesis";"";"";"";"";"4";""
"53.04";"Reparación de hernia inguinal indirecta con injerto o protes";"";"";"";"";"4";""
"53.05";"Reparación de hernia inguinal con injerto o prótesis,n.e.o.m";"";"";"";"";"4";""
"53.10";"Reparación bilateral de hernia inguinal, n. E . O. M.";"";"";"";"";"4";""
"53.11";"Reparación bilateral de hernia inguinal directa";"";"";"";"";"4";""
"53.12";"Reparación bilateral de hernia inguinal indirecta";"";"";"";"";"4";""
"53.13";"Repar. Bilat. De hernia inguinal, una directa y otra indirec";"";"";"";"";"4";""
"53.14";"Repar. Bilat. De hernia inguinal directa con injerto o prote";"";"";"";"";"4";""
"53.15";"Repar. Bilat. De hernia inguinal indirecta con injer. O prot";"";"";"";"";"4";""
"53.16";"Repar.bilat. De h.ing.una direc.y otra indir.,con inj.o prot";"";"";"";"";"4";""
"53.17";"Repar.bilat. De hernia ingui. Con injerto o prótesis,n.e.o.m";"";"";"";"";"4";""
"53.21";"Reparación unilateral de hernia crural con injerto o protesi";"";"";"";"";"4";""
"53.29";"Otra herniorrafia unilateral";"";"";"";"";"4";""
"53.31";"Reparación bilateral de hernia crural con injerto o prótesis";"";"";"";"";"4";""
"53.39";"Otra herniorrafia crural bilateral";"";"";"";"";"4";""
"53.41";"Reparación de hernia umbilical con prótesis";"";"";"";"";"4";""
"53.49";"Otra herniorrafia umbilical";"";"";"";"";"4";""
"53.51";"Reparación de hernia incisional (eventración)";"";"";"";"";"4";""
"53.59";"Reparación de otra hernia de la pared abdominal anterior";"";"";"";"";"4";""
"53.61";"Reparación de hernia incisional con prótesis";"";"";"";"";"4";""
"53.69";"Repar.de otra hernia de la pared abdominal anterior con prot";"";"";"";"";"4";""
"53.70";"Reparación de hernia diafragmatica, acceso abdominal";"";"";"";"";"4";""
"53.80";"Reparación de hernia diafragmatica con acceso toracico,n.e.o";"";"";"";"";"4";""
"53.81";"Plicatura de diafragma";"";"";"";"";"4";""
"53.82";"Reparación de hernia paraesternal (morgagni)";"";"";"";"";"4";""
"53.90";"Otra reparación de hernia";"";"";"";"";"4";""
"54.00";"Incisión de pared abdominal";"";"";"";"";"4";""
"54.11";"Laparotomía exploratoria";"";"";"";"";"4";""
"54.12";"Reapertura de laparotomía reciente";"";"";"";"";"4";""
"54.19";"Otra laparotomía";"";"";"";"";"4";""
"54.21";"Laparoscopia";"";"";"";"";"4";""
"54.22";"Biopsia de pared abdominal u ombligo";"";"";"";"";"4";""
"54.23";"Biopsia de peritoneo";"";"";"";"";"4";""
"54.24";"Biopsia cerrada [percutánea] [con aguja] de masa intraabdom.";"";"";"";"";"4";""
"54.25";"Lavado peritoneal";"";"";"";"";"4";""
"54.29";"Otros procedimientos diagnosticos sobre region abdominal";"";"";"";"";"4";""
"54.30";"Escisión o eliminación lesión/tejido pared abdominal u ombli";"";"";"";"";"4";""
"54.40";"Escisión o eliminación de tejido peritoneal";"";"";"";"";"4";""
"54.51";"Lisis laparoscopica de adherencias peritoneales";"";"";"";"";"4";""
"54.59";"Otras lisis de adherencia peritoneales";"";"";"";"";"4";""
"54.61";"Nuevo cierre de disrupción postoperatoria de pared abdominal";"";"";"";"";"4";""
"54.62";"Cierre retardado de herida abdominal en fase de granulación";"";"";"";"";"4";""
"54.63";"Otra sutura de pared abdominal";"";"";"";"";"4";""
"54.64";"Sutura de peritoneo";"";"";"";"";"4";""
"54.71";"Reparación de gastrosquisis";"";"";"";"";"4";""
"54.72";"Otra reparación de pared abdominal";"";"";"";"";"4";""
"54.73";"Otra reparación de peritoneo";"";"";"";"";"4";""
"54.74";"Otra reparación de epiplon";"";"";"";"";"4";""
"54.75";"Otra reparación de mesenterio";"";"";"";"";"4";""
"54.91";"Drenaje abdominal percutaneo";"";"";"";"";"4";""
"54.92";"Extracción de cuerpo extraño de la cavidad peritoneal";"";"";"";"";"4";""
"54.93";"Creación de fistula cutaneoperitoneal";"";"";"";"";"4";""
"54.94";"Creación de derivación peritoneo-vascular";"";"";"";"";"4";""
"54.95";"Incisión de peritoneo";"";"";"";"";"4";""
"54.96";"Inyección de aire en cavidad peritoneal";"";"";"";"";"4";""
"54.97";"Inyec.de sustancia terapeut.de acción local en cavidad perit";"";"";"";"";"4";""
"54.98";"Dialisis peritoneal";"";"";"";"";"4";""
"54.99";"Otra operación de la region abdominal ncoc";"";"";"";"";"4";""
"55.01";"Nefrotomía";"";"";"";"";"4";""
"55.02";"Nefrostomía";"";"";"";"";"4";""
"55.03";"Nefrostomía percutánea sin fragmentación";"";"";"";"";"4";""
"55.04";"Nefrostomía percutánea con fragmentación";"";"";"";"";"4";""
"55.11";"Pielotomía";"";"";"";"";"4";""
"55.12";"Pielostomía";"";"";"";"";"4";""
"55.21";"Nefroscopia";"";"";"";"";"4";""
"55.22";"Pieloscopia";"";"";"";"";"4";""
"55.23";"Biopsia cerrada percutánea [aguja] de riñon";"";"";"";"";"4";""
"55.24";"Biopsia abierta de riñon";"";"";"";"";"4";""
"55.29";"Otros procedimientos diagnosticos sobre el riñon";"";"";"";"";"4";""
"55.31";"Marsupialización de lesión renal";"";"";"";"";"4";""
"55.39";"Otra destrucción local o escisión de lesión o tejido renal";"";"";"";"";"4";""
"55.40";"Nefrectomía parcial";"";"";"";"";"4";""
"55.51";"Nefroureterectomía";"";"";"";"";"4";""
"55.52";"Nefrectomía de riñon restante";"";"";"";"";"4";""
"55.53";"Extarcción de riñon trasplantado o rechazado";"";"";"";"";"4";""
"55.54";"Nefrectomía bilateral";"";"";"";"";"4";""
"55.61";"Autotrasplante renal";"";"";"";"";"4";""
"55.69";"Otro trasplante de riñon";"";"";"";"";"4";""
"55.70";"Nefropexia";"";"";"";"";"4";""
"55.81";"Sutura de laceración de riñon";"";"";"";"";"4";""
"55.82";"Cierre de nefrostomía y pielostomía";"";"";"";"";"4";""
"55.83";"Cierre de otra fistula de rñon";"";"";"";"";"4";""
"55.84";"Reducción de torsión de pediculo renal";"";"";"";"";"4";""
"55.85";"Sinfisiotomía para riñon (anular) en herradura";"";"";"";"";"4";""
"55.86";"Anastomosis de riñon";"";"";"";"";"4";""
"55.87";"Corrección de union ureteropelvica";"";"";"";"";"4";""
"55.89";"Otra reparación de riñon ncoc";"";"";"";"";"4";""
"55.91";"Decapsulación de riñon";"";"";"";"";"4";""
"55.92";"Aspiración percutánea de riñon (pelvis)";"";"";"";"";"4";""
"55.93";"Sustitución de tubo de nefrostomía";"";"";"";"";"4";""
"55.94";"Sustitución de tubo de pielostomía";"";"";"";"";"4";""
"55.95";"Perfusión local de riñon";"";"";"";"";"4";""
"55.96";"Otra inyección de sustancia terapeutica en riñon";"";"";"";"";"4";""
"55.97";"Implantación o sustitución de riñon mecanico";"";"";"";"";"4";""
"55.98";"Extracción de riñon mecanico";"";"";"";"";"4";""
"55.99";"Otra operación sobre riñon ncoc";"";"";"";"";"4";""
"56.00";"Extirpación transuretral de obstruc. De ureter y pelvis rena";"";"";"";"";"4";""
"56.10";"Meatotomía ureteral";"";"";"";"";"4";""
"56.20";"Ureterotomía";"";"";"";"";"4";""
"56.31";"Ureteroscopia";"";"";"";"";"4";""
"56.32";"Biopsia percutánea cerrada de ureter";"";"";"";"";"4";""
"56.33";"Biopsia endoscopica cerrada de ureter";"";"";"";"";"4";""
"56.34";"Biopsia abierta de ureter";"";"";"";"";"4";""
"56.35";"Endoscopia (citoscopia) (looposcopia) del conducto ileal";"";"";"";"";"4";""
"56.39";"Otros procedimientos diagnosticos sobre ureter";"";"";"";"";"4";""
"56.40";"Ureterectomía n. E. O. M.";"";"";"";"";"4";""
"56.41";"Urterectomía parcial";"";"";"";"";"4";""
"56.42";"Ureterectomía total";"";"";"";"";"4";""
"56.51";"Formación de ureteroileostomía cutánea";"";"";"";"";"4";""
"56.52";"Revisión de ureteroileostomía cutánea";"";"";"";"";"4";""
"56.61";"Formación de otra ureterostomía cutánea";"";"";"";"";"4";""
"56.62";"Revisión de otra ureterostomía cutánea";"";"";"";"";"4";""
"56.71";"Derivación urinaria a intestino";"";"";"";"";"4";""
"56.72";"Revisión de anastomosis ureterointestinal";"";"";"";"";"4";""
"56.73";"Nefrocistanastomosis n. E. O .m.";"";"";"";"";"4";""
"56.74";"Ureteroneocistostomía";"";"";"";"";"4";""
"56.75";"Transureteroureterostomía";"";"";"";"";"4";""
"56.79";"Otra anastomosis o derivación de ureter ncoc";"";"";"";"";"4";""
"56.81";"Lisis de adherencias intraluminales de ureter";"";"";"";"";"4";""
"56.82";"Sutura de laceración de ureter";"";"";"";"";"4";""
"56.83";"Cierre de ureterostomía";"";"";"";"";"4";""
"56.84";"Cierre de otra fistula de ureter";"";"";"";"";"4";""
"56.85";"Ureteropexia";"";"";"";"";"4";""
"56.86";"Extracción de ligadura de ureter";"";"";"";"";"4";""
"56.89";"Otra reparación de ureter";"";"";"";"";"4";""
"56.91";"Dilatación del meato ureteral";"";"";"";"";"4";""
"56.92";"Implantación de estimulador ureteral electronico";"";"";"";"";"4";""
"56.93";"Sustitución de estimulador ureteral electronico";"";"";"";"";"4";""
"56.94";"Extracción de estimulador ureteral electronico";"";"";"";"";"4";""
"56.95";"Ligadura de ureter";"";"";"";"";"4";""
"56.99";"Otra operación sobre ureter";"";"";"";"";"4";""
"57.00";"Drenaje transuretral vesical";"";"";"";"";"4";""
"57.11";"Aspiración percutánea de vejiga";"";"";"";"";"4";""
"57.12";"Lisis de adherencias intraluminales con incisión en la vejig";"";"";"";"";"4";""
"57.17";"Cistostomía percutánea";"";"";"";"";"4";""
"57.18";"Otra cistostomía suprapubica";"";"";"";"";"4";""
"57.19";"Otra cistotomía";"";"";"";"";"4";""
"57.21";"Vesicostomía";"";"";"";"";"4";""
"57.22";"Revisión o sutura de vesicostomía";"";"";"";"";"4";""
"57.31";"Cistoscopia a traves de estoma artificial";"";"";"";"";"4";""
"57.32";"Otra cistoscopia";"";"";"";"";"4";""
"57.33";"Biopsia transureteral cerrada de vejiga";"";"";"";"";"4";""
"57.34";"Biopsia abierta de vejiga";"";"";"";"";"4";""
"57.39";"Otros procediminetos diagnosticos sobre vejiga";"";"";"";"";"4";""
"57.41";"Lisis tranuretral de adhesiones intraluminales";"";"";"";"";"4";""
"57.49";"Otra exc.o destruc. Transuretral de lesión o tej. De vejiga";"";"";"";"";"4";""
"57.51";"Escisión de uraco";"";"";"";"";"4";""
"57.59";"Escisión o destrucc.abierta de otra lesión o tej. De vejiga";"";"";"";"";"4";""
"57.60";"Cistectomía parcial";"";"";"";"";"4";""
"57.71";"Cistectomía radical";"";"";"";"";"4";""
"57.79";"Otra cistectomía total";"";"";"";"";"4";""
"57.81";"Sutura de laceración de vejiga";"";"";"";"";"4";""
"57.82";"Cierre de cistostomía";"";"";"";"";"4";""
"57.83";"Reparación de fistula con afectación de vejiga e intestino";"";"";"";"";"4";""
"57.84";"Reparación de otra fistula de vejiga";"";"";"";"";"4";""
"57.85";"Cistouretroplastia y reparación plastica de cuello de vejiga";"";"";"";"";"4";""
"57.86";"Reparación de extrofia de vejiga";"";"";"";"";"4";""
"57.87";"Reconstrucción de vejiga urinaria";"";"";"";"";"4";""
"57.88";"Otra anastomosis de vejiga";"";"";"";"";"4";""
"57.89";"Otra reparación de vejiga";"";"";"";"";"4";""
"57.91";"Esfinterotomía de vejiga";"";"";"";"";"4";""
"57.92";"Dilatación de cuello de vejiga";"";"";"";"";"4";""
"57.93";"Control de hemorragia (posoperatoria) de vejiga";"";"";"";"";"4";""
"57.94";"Inserción de cateter urinario permanente";"";"";"";"";"4";""
"57.95";"Sustitución de cateter urinario permanente";"";"";"";"";"4";""
"57.96";"Implantación de estimulador de vejiga electronico";"";"";"";"";"4";""
"57.97";"Sustitución de estimulador de vejiga electronico";"";"";"";"";"4";""
"57.98";"Extracción de estimulador de vejiga electronico";"";"";"";"";"4";""
"57.99";"Otra operación sobre vejiga ncoc";"";"";"";"";"4";""
"58.00";"Uretrotomía";"";"";"";"";"4";""
"58.10";"Meatotomía uretral";"";"";"";"";"4";""
"58.21";"Uretroscopia perineal";"";"";"";"";"4";""
"58.22";"Otra uretroscopia";"";"";"";"";"4";""
"58.23";"Biopsia de uretra";"";"";"";"";"4";""
"58.24";"Biopsia de tejido periuretral";"";"";"";"";"4";""
"58.29";"Otros proc.diagn. Sobre uretra y tejido periuretral";"";"";"";"";"4";""
"58.31";"Escisión endoscopica o destrucción de lesión o tejido uretra";"";"";"";"";"4";""
"58.39";"Otra escisión local o destrucción de lesión o de tej. Uretra";"";"";"";"";"4";""
"58.41";"Sutura de laceración de uretra";"";"";"";"";"4";""
"58.42";"Cierre de uretrostomía";"";"";"";"";"4";""
"58.43";"Cierre de otra fistula de uretra";"";"";"";"";"4";""
"58.44";"Reanastomosis de uretra";"";"";"";"";"4";""
"58.45";"Reparación de hipospadias o epispadias";"";"";"";"";"4";""
"58.46";"Otra reconstrucción de uretra";"";"";"";"";"4";""
"58.47";"Meatoplastia uretral";"";"";"";"";"4";""
"58.49";"Otra reparación de uretra";"";"";"";"";"4";""
"58.50";"Liberación de estenosis uretral";"";"";"";"";"4";""
"58.60";"Dilatación de uretra";"";"";"";"";"4";""
"58.91";"Incisión de tejido periuretral";"";"";"";"";"4";""
"58.92";"Escisión de tejido periuretral";"";"";"";"";"4";""
"58.93";"Implantación de esfinter urinario artificial [aus]";"";"";"";"";"4";""
"58.99";"Otra operación sobre uretra y tejido periuretral ncoc";"";"";"";"";"4";""
"59.00";"Disección retroperitoneal n. E .o .m.";"";"";"";"";"4";""
"59.02";"Otra lisis de adherencias perirrenales o periureterales";"";"";"";"";"4";""
"59.03";"Lisis laparoscopica de adherencia perirrenales o periuretera";"";"";"";"";"4";""
"59.09";"Otra incisión de tejido perirrenal o periureteral";"";"";"";"";"4";""
"59.11";"Lisis de adherencias perivesicales";"";"";"";"";"4";""
"59.12";"Lisis laparoscopica de adherencias perivesicales";"";"";"";"";"4";""
"59.19";"Otra incisión de tejido perivesical";"";"";"";"";"4";""
"59.21";"Biopsia de tejido perirrenal o perivesical";"";"";"";"";"4";""
"59.29";"Otros proc.diag.sobre tej.perirrenal,perivesical y retroperi";"";"";"";"";"4";""
"59.30";"Plicatura de union uretrovesical";"";"";"";"";"4";""
"59.40";"Operación de suspensión suprapubica";"";"";"";"";"4";""
"59.50";"Suspensión uretral retropubica";"";"";"";"";"4";""
"59.60";"Suspensión parauretral";"";"";"";"";"4";""
"59.71";"Operación de musculo elevador para suspensión uretrovesical";"";"";"";"";"4";""
"59.72";"Inyección de implante en cuello vesical o intrauretral";"";"";"";"";"4";""
"59.79";"Otra reparación de continencia urinaria de esfuerzo ncoc";"";"";"";"";"4";""
"59.80";"Cateterismo ureteral";"";"";"";"";"4";""
"59.91";"Escisión de tejido perirrenal o perivesical";"";"";"";"";"4";""
"59.92";"Otras operaciones sobre tejido perirrenal o perivesical";"";"";"";"";"4";""
"59.93";"Sustitución de tubo de ureterostomía";"";"";"";"";"4";""
"59.94";"Sustitución de tubo de cistostomía";"";"";"";"";"4";""
"59.95";"Fragmentación por ultrasonido de calculos urinarios";"";"";"";"";"4";""
"59.99";"Otra operación sobre aparat urinario ncoc";"";"";"";"";"4";""
"60.00";"Incisión de prostata";"";"";"";"";"4";""
"60.11";"Biopsia cerrada (por aguja) (percutánea) de prostata";"";"";"";"";"4";""
"60.12";"Biopsia abierta de prostata";"";"";"";"";"4";""
"60.13";"Biopsia cerrada percutánea de vesiculas seminales";"";"";"";"";"4";""
"60.14";"Biopsia abierta de vesiculas seminales";"";"";"";"";"4";""
"60.15";"Biopsia de tejido periprostatico";"";"";"";"";"4";""
"60.18";"Otros proc.diagn. Sobre prostata y tejido periprostatico";"";"";"";"";"4";""
"60.19";"Otros proc.diagn. Sobre vesiculas seminales";"";"";"";"";"4";""
"60.21";"Prostatectomía transuretral guiado por laser inducido";"";"";"";"";"4";""
"60.29";"Otra prostatectomía transuretral";"";"";"";"";"4";""
"60.30";"Prostatectomía suprapubica";"";"";"";"";"4";""
"60.40";"Prostatectomía retropubica";"";"";"";"";"4";""
"60.50";"Prostatectomía radical";"";"";"";"";"4";""
"60.61";"Escisión local de lesión de prostata";"";"";"";"";"4";""
"60.62";"Prostatectomía perineal";"";"";"";"";"4";""
"60.69";"Otra prostatectomía ncoc";"";"";"";"";"4";""
"60.71";"Aspiración percutánea de vesiculas seminales";"";"";"";"";"4";""
"60.72";"Incisión de vesicula seminal";"";"";"";"";"4";""
"60.73";"Escisión de vesicula seminal";"";"";"";"";"4";""
"60.79";"Otras operaciones sobre vesiculas seminales";"";"";"";"";"4";""
"60.81";"Incisión de tejido periprostatico";"";"";"";"";"4";""
"60.82";"Escisión de tejido periprostatico";"";"";"";"";"4";""
"60.91";"Aspiración percutánea de prostata";"";"";"";"";"4";""
"60.92";"Inyección en prostata";"";"";"";"";"4";""
"60.93";"Reparación de prostata";"";"";"";"";"4";""
"60.94";"Control de hemorragia posoperatoria de prostata";"";"";"";"";"4";""
"60.95";"Dilatación transuretral por balon de uretra prostatica";"";"";"";"";"4";""
"60.96";"Destrucción transuretral de tejido prostatico por termoterapia con microondas";"";"";"";"";"4";""
"60.97";"Destrucción transuretral de tejido prostatico con otra termoterapia";"";"";"";"";"4";""
"60.99";"Otra operación sobre prostata ncoc";"";"";"";"";"4";""
"61.00";"Incisión y drenaje de escroto y tunica vaginal";"";"";"";"";"4";""
"61.11";"Biopsia de escroto o tunica vaginal";"";"";"";"";"4";""
"61.19";"Otros proc.diagn. Sobre escroto y tunica vaginal";"";"";"";"";"4";""
"61.20";"Escisión de hidrocele (de tunica vaginal)";"";"";"";"";"4";""
"61.30";"Escisión o destrucción de lesión o tejido de escroto";"";"";"";"";"4";""
"61.41";"Sutura de laceración de escroto y tunica vaginal";"";"";"";"";"4";""
"61.42";"Reparación de fistula escrotal";"";"";"";"";"4";""
"61.49";"Otra reparación de escroto y tunica vaginal";"";"";"";"";"4";""
"61.91";"Aspiración percutánea de tunica vaginal";"";"";"";"";"4";""
"61.92";"Escisión de lesión de tunica vaginal salvo hidrocele";"";"";"";"";"4";""
"61.99";"Otra operación sobre escroto y tunica vaginal ncoc";"";"";"";"";"4";""
"62.00";"Incisión de testiculo";"";"";"";"";"4";""
"62.11";"Biopsia cerrada (percutánea) (por aguja) de testiculo";"";"";"";"";"4";""
"62.12";"Biopsia abierta de testiculo";"";"";"";"";"4";""
"62.19";"Otros procedimientos diagnosticos sobre testiculos";"";"";"";"";"4";""
"62.20";"Escisión o destrucción de lesión testicular";"";"";"";"";"4";""
"62.30";"Orquiectomía unilateral";"";"";"";"";"4";""
"62.41";"Extirpación de ambos testiculos en el mismo episodio operato";"";"";"";"";"4";""
"62.42";"Extirpación de testiculo restante";"";"";"";"";"4";""
"62.50";"Orquidopexia";"";"";"";"";"4";""
"62.61";"Sutura de laceración de testiculo";"";"";"";"";"4";""
"62.69";"Otra reparación de testiculo";"";"";"";"";"4";""
"62.70";"Inserción de prótesis testicular";"";"";"";"";"4";""
"62.91";"Aspiración de testiculo";"";"";"";"";"4";""
"62.92";"Inyección de sustancia terapeutica en testiculo";"";"";"";"";"4";""
"62.99";"Otra operación sobre testiculo ncoc";"";"";"";"";"4";""
"63.01";"Biopsia de cordon espermatico, epididimo o conducto deferent";"";"";"";"";"4";""
"63.09";"Otros proc.dig. Sobre cordon espermatico,epididimo y cond.d.";"";"";"";"";"4";""
"63.10";"Escisión de varicocele e hidrocele de cordon espermatico";"";"";"";"";"4";""
"63.20";"Escisión de quiste de epididimo";"";"";"";"";"4";""
"63.30";"Escisión otra lesión o tejido de cordon espermatico y epidid";"";"";"";"";"4";""
"63.40";"Epididimectomía";"";"";"";"";"4";""
"63.51";"Sutura de laceración de cordon espermatico y epididimo";"";"";"";"";"4";""
"63.52";"Reducción de torsión de testiculo o cordon espermatico";"";"";"";"";"4";""
"63.53";"Trasplante de cordon espermatico";"";"";"";"";"4";""
"63.59";"Otra reparación de cordon espermatico y epididimo";"";"";"";"";"4";""
"63.60";"Vasotomía";"";"";"";"";"4";""
"63.70";"Procedimiento de esterilización masculina, n. E. O. M.";"";"";"";"";"4";""
"63.71";"Ligadura de conducto deferente";"";"";"";"";"4";""
"63.72";"Ligadura de cordon espermatico";"";"";"";"";"4";""
"63.73";"Vasectomía";"";"";"";"";"4";""
"63.81";"Sutura de laceración de conducto deferente y epididimo";"";"";"";"";"4";""
"63.82";"Reconstrucción de conducto deferente dividido quirurgicament";"";"";"";"";"4";""
"63.83";"Epididimovasostomía";"";"";"";"";"4";""
"63.84";"Retirada de ligadura de conducto deferente";"";"";"";"";"4";""
"63.85";"Extracción de válvula de conducto deferente";"";"";"";"";"4";""
"63.89";"Otra reparación de conducto deferente y epididimo";"";"";"";"";"4";""
"63.91";"Aspiración de espermatocele";"";"";"";"";"4";""
"63.92";"Epididimotomía";"";"";"";"";"4";""
"63.93";"Incisión de cordon espermatico";"";"";"";"";"4";""
"63.94";"Lisis de adherencias de cordon espermatico";"";"";"";"";"4";""
"63.95";"Inserción de válvula en vaso deferente";"";"";"";"";"4";""
"63.99";"Otra oper. Sobre c.espermatico, epididimo y c. Deferen. Ncoc";"";"";"";"";"4";""
"64.00";"Circuncisión";"";"";"";"";"4";""
"64.11";"Biopsia de pene";"";"";"";"";"4";""
"64.19";"Otros procedimientos diagnosticos sobre el pene";"";"";"";"";"4";""
"64.20";"Escisión local o destrucción de lesión de pene";"";"";"";"";"4";""
"64.30";"Amputación de pene";"";"";"";"";"4";""
"64.41";"Sutura de laceración de pene";"";"";"";"";"4";""
"64.42";"Liberación de";"";"";"";"";"4";""
"64.43";"Construcción de pene";"";"";"";"";"4";""
"64.44";"Reconstrucción de pene";"";"";"";"";"4";""
"64.45";"Reimplantación de pene";"";"";"";"";"4";""
"64.49";"Otra reparación de pene";"";"";"";"";"4";""
"64.50";"Operaciones para transformación de sexo, [ncoc]";"";"";"";"";"4";""
"64.91";"Corte dorsal o lateral de prepucio";"";"";"";"";"4";""
"64.92";"Incisión de pene";"";"";"";"";"4";""
"64.93";"División de adherencias de pene";"";"";"";"";"4";""
"64.94";"Colocación de prótesis externa de pene";"";"";"";"";"4";""
"64.95";"Inserción o sustitución de prótesis de pene no inflable";"";"";"";"";"4";""
"64.96";"Extracción de prótesis interna de pene";"";"";"";"";"4";""
"64.97";"Inserción o sustitución de prótesis de pene inflable";"";"";"";"";"4";""
"64.98";"Otras operaciones sobre el pene";"";"";"";"";"4";""
"64.99";"Otra operación sobre organos genitales masculinos ncoc";"";"";"";"";"4";""
"65.01";"Ooforotomía laparoscopica";"";"";"";"";"4";""
"65.09";"Otra ooforotomía";"";"";"";"";"4";""
"65.11";"Biopsia por aspiración de ovario";"";"";"";"";"4";""
"65.12";"Otra biopsia de ovario";"";"";"";"";"4";""
"65.13";"Biopsia laparoscopica de ovario";"";"";"";"";"4";""
"65.14";"Otro proc. Diagnostico laparoscopico de ovario";"";"";"";"";"4";""
"65.19";"Otros procedimientos diagnosticos sobre ovarios";"";"";"";"";"4";""
"65.21";"Marsupialización de quiste ovarico";"";"";"";"";"4";""
"65.22";"Resección en cuña de ovario";"";"";"";"";"4";""
"65.23";"Marsupialización laparoscopica de quiste ovarico";"";"";"";"";"4";""
"65.24";"Resección en cu'aparoscopica de ovario";"";"";"";"";"4";""
"65.25";"Otra escisión local o destrucción laparoscopica de ovario";"";"";"";"";"4";""
"65.29";"Otra escisión local o destrucción de ovario";"";"";"";"";"4";""
"65.31";"Ooforectomía unilateral laparoscopica";"";"";"";"";"4";""
"65.39";"Otra ooforectomía unilateral";"";"";"";"";"4";""
"65.41";"Salpingooforectomía unilateral laparoscopica";"";"";"";"";"4";""
"65.49";"Otra salpingooforectomía unilateral";"";"";"";"";"4";""
"65.51";"Extirpación de ambos ovarios en un mismo tiempo operatorio";"";"";"";"";"4";""
"65.52";"Extirpación de ovario restante";"";"";"";"";"4";""
"65.53";"Extirpación laparoscopica de ambos ovarios en un mismo acto";"";"";"";"";"4";""
"65.54";"Extirpación laparoscopica de ovario restante";"";"";"";"";"4";""
"65.61";"Extirp. De ambos ovarios y trompas en un mismo tiempo operat";"";"";"";"";"4";""
"65.62";"Extirpación de ovario y trompa restantes";"";"";"";"";"4";""
