"31.79";"Otras operaciones de reconstrucción y plastica sobre traquea";"";"";"";"";"4";""
"31.91";"Sección de nervio laringeo";"";"";"";"";"4";""
"31.92";"Lisis de adherencias de traquea o laringe";"";"";"";"";"4";""
"31.93";"Sustitución de tutor laringeo o traqueal";"";"";"";"";"4";""
"31.94";"Inyección sustancia terapeutica de acción local en traquea";"";"";"";"";"4";""
"31.95";"Fistulización traqueoesofagica";"";"";"";"";"4";""
"31.98";"Otras operaciones sobre laringe";"";"";"";"";"4";""
"31.99";"Otras operaciones sobre traquea";"";"";"";"";"4";""
"32.01";"Escisión endoscopica o destrucción de lesión o tejido bronqu";"";"";"";"";"4";""
"32.09";"Otra escisión o destrucción local de lesión o tejido bronqui";"";"";"";"";"4";""
"32.10";"Otra escisión de bronquio";"";"";"";"";"4";""
"32.21";"Plicación de bulla enfisematosa";"";"";"";"";"4";""
"32.22";"Reducción quirurgica de volumen pulmonar";"";"";"";"";"4";""
"32.28";"Escisión endoscopica o destrucción de lesión o tejido pulmon";"";"";"";"";"4";""
"32.29";"Otra escisión local o destrucción de lesión o tejido pulmona";"";"";"";"";"4";""
"32.30";"Resección segmentaria de pulmon";"";"";"";"";"4";""
"32.40";"Lobectomía de pulmon";"";"";"";"";"4";""
"32.50";"Neumonectomía total";"";"";"";"";"4";""
"32.60";"Disección radical de estructuras toracicas";"";"";"";"";"4";""
"32.90";"Otra escisión de pulmon";"";"";"";"";"4";""
"33.00";"Incisión de bronquio";"";"";"";"";"4";""
"33.10";"Incisión de pulmon";"";"";"";"";"4";""
"33.21";"Broncoscopia a traves de estoma artificial";"";"";"";"";"4";""
"33.22";"Broncoscopia fibrooptica";"";"";"";"";"4";""
"33.23";"Otra broncoscopia";"";"";"";"";"4";""
"33.24";"Biopsia cerrada bronquial endoscopica";"";"";"";"";"4";""
"33.25";"Biopsia abierta de bronquio";"";"";"";"";"4";""
"33.26";"Biopsia [percutánea] cerrada [aguja] de pulmon";"";"";"";"";"4";""
"33.27";"Biopsia cerrada endoscopica de pulmon";"";"";"";"";"4";""
"33.28";"Biopsia abierta de pulmon";"";"";"";"";"4";""
"33.29";"Otros procedimientos diagnosticos sobre pulmon y bronquio";"";"";"";"";"4";""
"33.31";"Colapso de pulmon por destrucción de nervio frenico";"";"";"";"";"4";""
"33.32";"Colapso de pulmon por neumotorax artificial";"";"";"";"";"4";""
"33.33";"Colapso de pulmon por neumoperitoneo";"";"";"";"";"4";""
"33.34";"Taracoplastia";"";"";"";"";"4";""
"33.39";"Otro colapso quirurgico de pulmon";"";"";"";"";"4";""
"33.41";"Sutura de laceración bronquial";"";"";"";"";"4";""
"33.42";"Cierre de fistula bronquial";"";"";"";"";"4";""
"33.43";"Cierre de laceración de pulmon";"";"";"";"";"4";""
"33.48";"Otras operaciones de reparación y plastica sobre bronquio";"";"";"";"";"4";""
"33.49";"Otras operaciones de reparación y plasticas sobre pulmon";"";"";"";"";"4";""
"33.50";"Trasplante de pulmon no especificado de otra manera";"";"";"";"";"4";""
"33.51";"Trasplante unilateral de pulmon";"";"";"";"";"4";""
"33.52";"Trasplante bilateral de pulmon";"";"";"";"";"4";""
"33.60";"Trasplante combinado de corazon-pulmon";"";"";"";"";"4";""
"33.91";"Dilatación bronquial";"";"";"";"";"4";""
"33.92";"Ligadura de bronquio";"";"";"";"";"4";""
"33.93";"Punción de pulmon";"";"";"";"";"4";""
"33.98";"Otras operaciones sobre bronquio";"";"";"";"";"4";""
"33.99";"Otras operaciones sobre pulmon";"";"";"";"";"4";""
"34.01";"Incisión de pared toracica";"";"";"";"";"4";""
"34.02";"Taracotomía exploratoria";"";"";"";"";"4";""
"34.03";"Reapertura a traves de toracotomía reciente";"";"";"";"";"4";""
"34.04";"Inserción de cateter intercostal para drenaje";"";"";"";"";"4";""
"34.05";"Creación de derivación pleuroperitoneal";"";"";"";"";"4";""
"34.09";"Otra incisión de pleura";"";"";"";"";"4";""
"34.10";"Incisión de mediastino";"";"";"";"";"4";""
"34.21";"Toracoscopia transpleural";"";"";"";"";"4";""
"34.22";"Mediastinoscopia";"";"";"";"";"4";""
"34.23";"Biopsia de pared toracica";"";"";"";"";"4";""
"34.24";"Biopsia pleural";"";"";"";"";"4";""
"34.25";"Biopsia percutánea [aguja] cerrada de mediastino";"";"";"";"";"4";""
"34.26";"Biopsia abierta de mediastino";"";"";"";"";"4";""
"34.27";"Biopsia de diafragma";"";"";"";"";"4";""
"34.28";"Otros proc. Diag. Sobre pared toracica, pleura y diafragma";"";"";"";"";"4";""
"34.29";"Otros procedimientos diagnosticos sobre  mediastino";"";"";"";"";"4";""
"34.30";"Escisión o destrucción de lesión o tejido de mediastino";"";"";"";"";"4";""
"34.40";"Escisión o destrucción de lesión de pared toracica";"";"";"";"";"4";""
"34.51";"Decorticación de pulmon";"";"";"";"";"4";""
"34.59";"Otra escisión de pleura";"";"";"";"";"4";""
"34.60";"Escarificación de pleura";"";"";"";"";"4";""
"34.71";"Sutura de laceración de pared toracica";"";"";"";"";"4";""
"34.72";"Cierre de toracostomía";"";"";"";"";"4";""
"34.73";"Cierre de otra fistula de torax";"";"";"";"";"4";""
"34.74";"Reparación de deformidad de pectus";"";"";"";"";"4";""
"34.79";"Otra reparación sobre diafragma";"";"";"";"";"4";""
"34.81";"Escisión de lesión o tejido de diafragma";"";"";"";"";"4";""
"34.82";"Sutura de laceración de diafragma";"";"";"";"";"4";""
"34.83";"Cierre de fistula de diafragma";"";"";"";"";"4";""
"34.84";"Otra operación de diafragma";"";"";"";"";"4";""
"34.85";"Implantación de marcapasos diafragmatico";"";"";"";"";"4";""
"34.89";"Otras operaciones sobre diafragma";"";"";"";"";"4";""
"34.91";"Toracentesis";"";"";"";"";"4";""
"34.92";"Inyección en cavidad toracica";"";"";"";"";"4";""
"34.93";"Reparación de pleura";"";"";"";"";"4";""
"34.99";"Otra operación sobre torax ncoc";"";"";"";"";"4";""
"35.00";"Valvulotomía cardiaca cerrada, válvula no especificada";"";"";"";"";"4";""
"35.01";"Valvotomía cardiaca cerrada, válvula aortica";"";"";"";"";"4";""
"35.02";"Valvotomía cardiaca cerrada, válvula mitral";"";"";"";"";"4";""
"35.03";"Valvotomía cardiaca cerrada, válvula pulmonar";"";"";"";"";"4";""
"35.04";"Valvotomía cardiaca cerrada, válvula tricuspide";"";"";"";"";"4";""
"35.10";"Valvuloplastia cardiaca abierta sin sustitución,válvula no e";"";"";"";"";"4";""
"35.11";"Valvuloplas. Cardiaca abierta de válvula aortica sin sustitu";"";"";"";"";"4";""
"35.12";"Valvuloplast. Cardiaca abierta de válvula mitral sin sustitu";"";"";"";"";"4";""
"35.13";"Valvulopla. Cardiaca abierta de válvula pulmonar sin sustitu";"";"";"";"";"4";""
"35.14";"Valvulop. Cardiaca abierta de válvula tricuspide sin sustitu";"";"";"";"";"4";""
"35.20";"Sustitución de válvula cardiaca no especificada";"";"";"";"";"4";""
"35.21";"Sustitución de válvula aortica con injerto de tejido";"";"";"";"";"4";""
"35.22";"Otra sustitución de válvula aortica";"";"";"";"";"4";""
"35.23";"Sustitución de válvula mitral con injerto de tejido";"";"";"";"";"4";""
"35.24";"Otra sustitución de válvula mitral";"";"";"";"";"4";""
"35.25";"Sustitución de válvula pulmonar con injerto de tejido";"";"";"";"";"4";""
"35.26";"Otra sustitución de válvula pulmonar";"";"";"";"";"4";""
"35.27";"Sustitución de válvula tricuspide con injerto de tejido";"";"";"";"";"4";""
"35.28";"Otra sustitución de válvula tricuspide";"";"";"";"";"4";""
"35.31";"Operaciones sobre musculo papilar";"";"";"";"";"4";""
"35.32";"Operaciones sobre cuerdas tendinosas";"";"";"";"";"4";""
"35.33";"Anuloplastia";"";"";"";"";"4";""
"35.34";"Infundibulectomía";"";"";"";"";"4";""
"35.35";"Operaciones sobre trabeculas del corazon";"";"";"";"";"4";""
"35.39";"Op. Sobre otras estructuras adyacentes a las válvulas cardia";"";"";"";"";"4";""
"35.41";"Ampliación de defecto existente de tabique interauricular";"";"";"";"";"4";""
"35.42";"Creación de defecto de tabique en el corazon";"";"";"";"";"4";""
"35.50";"Reparación de defecto n. E. De tabiques cardiacos con protes";"";"";"";"";"4";""
"35.51";"Rep.defecto de tabique interauricu.con prótesis,tecnica abie";"";"";"";"";"4";""
"35.52";"Rep.defecto de tabique interauric.con prótesis, tecnica cerr";"";"";"";"";"4";""
"35.53";"Reparación de defecto de tabique interventricular con protes";"";"";"";"";"4";""
"35.54";"Reparación de defecto de cojines endocardicos con prótesis";"";"";"";"";"4";""
"35.60";"Rep. De defecto de tabique cardiaco n. E. Con injerto de tej";"";"";"";"";"4";""
"35.61";"Rep.defecto de tabique interauricular con injerto de tejido";"";"";"";"";"4";""
"35.62";"Rep.de defecto de tabique interventricular con injerto de te";"";"";"";"";"4";""
"35.63";"Repar.de defecto de cojines endocardicos con injerto de teji";"";"";"";"";"4";""
"35.70";"Otra reparación no especificada defectos de tabiques cardiac";"";"";"";"";"4";""
"35.71";"Otra rep. No especificada de defecto de tabique interauricul";"";"";"";"";"4";""
"35.72";"Otra rep. No especif. De defecto de tabique interventricular";"";"";"";"";"4";""
"35.73";"Otra rep. No especif. De defecto de cojines endocardicos";"";"";"";"";"4";""
"35.81";"Reparación total de tetralogia de fallot";"";"";"";"";"4";""
"35.82";"Reparación completa de drenaje venoso pulmonar anomalo total";"";"";"";"";"4";""
"35.83";"Reparación total de tronco arterioso";"";"";"";"";"4";""
"35.84";"Correc.total o transp.grandes vasos,no clasif. Otro concepto";"";"";"";"";"4";""
"35.91";"Transposición interauricular del retorno venoso";"";"";"";"";"4";""
"35.92";"Creación de conducto entre el ventri. Derecho y la art. Pulm";"";"";"";"";"4";""
"35.93";"Creación de conducto entre el ventriculo izquierdo y la aort";"";"";"";"";"4";""
"35.94";"Creación de conducto entre auricula y arteria pulmonar";"";"";"";"";"4";""
"35.95";"Revisión de procedimiento correctivo sobre el corazon";"";"";"";"";"4";""
"35.96";"Valvuloplastia percutánea";"";"";"";"";"4";""
"35.98";"Otras operaciones sobre tabiques cardiacos";"";"";"";"";"4";""
"35.99";"Otras operaciones sobre válvulas cardiacas";"";"";"";"";"4";""
"36.01";"Angioplas.coron. Translum. Percut. V.unico, ater.cor. Sin tr";"";"";"";"";"4";""
"36.02";"Ang. Coron. Translum. Percut. V. Unico, ater. Cor. Con tromb";"";"";"";"";"4";""
"36.03";"Angioplastia de arteria coronaria con torax abierto";"";"";"";"";"4";""
"36.04";"Infusión trombolitica de arteria intracoronaria";"";"";"";"";"4";""
"36.05";"Ang.cor.transl.perct. De mult.vasos, durante oper. C/s ag.tr";"";"";"";"";"4";""
"36.06";"Inserción de stent en arteria coronaria";"";"";"";"";"4";""
"36.09";"Otra eliminación de obstrucción de arteria coronaria";"";"";"";"";"4";""
"36.10";"Anastomosis aortocoronaria para revascularización cardiaca";"";"";"";"";"4";""
"36.11";"Anastomosis aortocoronaria de una arteria coronaria";"";"";"";"";"4";""
"36.12";"Anastomosis aortocoronaria de dos arterias coronarias";"";"";"";"";"4";""
"36.13";"Anastomosis aortocoronariao de tres arterias coronarias";"";"";"";"";"4";""
"36.14";"Anastomosis aortocoronaria de cuatro o mas arterias coronar";"";"";"";"";"4";""
"36.15";"Anastomosis interna simple de arteria mamaria-arteria corona";"";"";"";"";"4";""
"36.16";"Anastomosis interna doble de arteria mamaria-arteria corona";"";"";"";"";"4";""
"36.17";"Anastomosis de la arteria coronaria abdominal";"";"";"";"";"4";""
"36.19";"Otra anastomosis por desviacio para revasculización cardiaca";"";"";"";"";"4";""
"36.20";"Revasculización cardiaca por implantación arterial";"";"";"";"";"4";""
"36.31";"Revascularizacióntransmiocardica con torax abierto";"";"";"";"";"4";""
"36.32";"Otra revascularización transmiocardica";"";"";"";"";"4";""
"36.39";"Otra revascularización del corazon";"";"";"";"";"4";""
"36.91";"Reparación de aneurisma de vaso coronario";"";"";"";"";"4";""
"36.99";"Otras operaciones sobre vasos cardiacos";"";"";"";"";"4";""
"37.00";"Pericardiocentesis";"";"";"";"";"4";""
"37.10";"Incisión de corazon, neom";"";"";"";"";"4";""
"37.11";"Cardiotomía";"";"";"";"";"4";""
"37.12";"Pericardiotomía";"";"";"";"";"4";""
"37.21";"Cateterismo cardiaco del lado derecho del corazon";"";"";"";"";"4";""
"37.22";"Cateterismo cardiaco del lado izquierdo del corazon";"";"";"";"";"4";""
"37.23";"Cateterismo combinado de los lados derecho e izqdo del coraz";"";"";"";"";"4";""
"37.24";"Biopsia de pericardio";"";"";"";"";"4";""
"37.25";"Biopsia de corazon";"";"";"";"";"4";""
"37.26";"Estimulación electrofisiologica cardiaca y estudios de regis";"";"";"";"";"4";""
"37.27";"Mapeo cardiaco";"";"";"";"";"4";""
"37.29";"Otros procedimientos diagnosticos sobre corazon y pericardio";"";"";"";"";"4";""
"37.31";"Pericardiectomía";"";"";"";"";"4";""
"37.32";"Escisión de aneurisma de corazon";"";"";"";"";"4";""
"37.33";"Escisión de destrucción de otra lesión o tejido del corazon";"";"";"";"";"4";""
"37.34";"Ablación cateterica de lesión o tejidos del corazon";"";"";"";"";"4";""
"37.35";"Ventriculectomía parcial";"";"";"";"";"4";""
"37.40";"Reparación de corazon y pericardio";"";"";"";"";"4";""
"37.50";"Trasplante de corazon";"";"";"";"";"4";""
"37.61";"Implantación de balon contrapulsación";"";"";"";"";"4";""
"37.62";"Implantación de otro sistema de asistencia cardiaca";"";"";"";"";"4";""
"37.63";"Sustitución y reparación de sistema de asistencia cardiaca";"";"";"";"";"4";""
"37.64";"Extracción de sistema de asistencia cardiaca";"";"";"";"";"4";""
"37.65";"Implante de un sistema de asistencia cardiaca pulsatil exter";"";"";"";"";"4";""
"37.66";"Implante de un sistema de asistencia cardiaca pulsatil impla";"";"";"";"";"4";""
"37.67";"Implantación de sistema de cardiomioestimulación";"";"";"";"";"4";""
"37.70";"Inserción inicial de derivaciones electrodos, n. E. O. M.";"";"";"";"";"4";""
"37.71";"Inserción inicial de derivac. Electrodos transvenosos ventri";"";"";"";"";"4";""
"37.72";"Inserción inicial derivac transvenosos en auricula y ventric";"";"";"";"";"4";""
"37.73";"Inserción inicial electrodos transvenosos en atrio";"";"";"";"";"4";""
"37.74";"Inserción o sustitución de derivación electrodo epicardial";"";"";"";"";"4";""
"37.75";"Revisión derivación electrodo";"";"";"";"";"4";""
"37.76";"Sustitución de electrodo transvenoso en auricula y";"";"";"";"";"4";""
"37.77";"Eliminación de electrodo sin sutitución";"";"";"";"";"4";""
"37.78";"Inserción de un sistema de marcapasos transvenoso temporal";"";"";"";"";"4";""
"37.79";"Revisión o reubicación de receptaculo de marcapasos";"";"";"";"";"4";""
"37.80";"Inserción marcapasos permanente,inicial o sust.sin esp.apara";"";"";"";"";"4";""
"37.81";"Inser.inicial dispositivo camara unica, no especf.ritmo sens";"";"";"";"";"4";""
"37.82";"Inser.inicial de aparato camara unica, ritmo sensible";"";"";"";"";"4";""
"37.83";"Inserción inicial de aparato de camara doble";"";"";"";"";"4";""
"37.85";"Sustit.cualq.tipo marcapaso apar.camara unica,no esp.rit.sen";"";"";"";"";"4";""
"37.86";"Sustit.cualq.tipo marcapaso con apar. Camara unica,ritmo sen";"";"";"";"";"4";""
"37.87";"Sustit. Cualquier tipo marcapasos con disp. Camara doble";"";"";"";"";"4";""
"37.89";"Revisión o eliminación de marcapasos cardiaco";"";"";"";"";"4";""
"37.91";"Masaje cardiaco a torax abierto";"";"";"";"";"4";""
"37.92";"Inyección de sustancia terapeutica en corazon";"";"";"";"";"4";""
"37.93";"Inyección de sustancia terapeutica en pericardio";"";"";"";"";"4";""
"37.94";"Implant.o sustit.de cardioversor/desfibrilador automatico,[a";"";"";"";"";"4";""
"37.95";"Implant.de cardiover/desfibrilador automatico,solo derivacio";"";"";"";"";"4";""
"37.96";"Implant.de cardiover/desfibr. Automat.solo generador del pul";"";"";"";"";"4";""
"37.97";"Sustitución de cardiover/desfibr.automatico,solo derivacione";"";"";"";"";"4";""
"37.98";"Sustit.de cardiov/desfibr.automatico,solo generador de pulso";"";"";"";"";"4";""
"37.99";"Otra operación sobre corazon y pericardio ncoc";"";"";"";"";"4";""
"38.00";"Incisión, escisión y oclusión de vasos sitio no especificado";"";"";"";"";"4";""
"38.01";"Incisión, escisión y oclusión de vasos intracraneales";"";"";"";"";"4";""
"38.02";"Incisión, escisión y oclusión de otros v. De cabeza y cuello";"";"";"";"";"4";""
"38.03";"Incisión, escisión y oclusión de vasos de miembros superiore";"";"";"";"";"4";""
"38.04";"Incisión, escisión y oclusión de aorta";"";"";"";"";"4";""
"38.05";"Incisión, escisión y oclusión de otros vasos toracicos";"";"";"";"";"4";""
"38.06";"Incisión, escisión y oclusión de arterias abdominales";"";"";"";"";"4";""
"38.07";"Incisión, escisión y oclusión de venas abdominales";"";"";"";"";"4";""
"38.08";"Incisión, escisión y oclusión arterias de miembros inferiore";"";"";"";"";"4";""
"38.09";"Incisión, escisión y oclusión de venas de miembros inferiore";"";"";"";"";"4";""
"38.10";"Endarterectomía de sitio no especificado";"";"";"";"";"4";""
"38.11";"Endarterectomía de vasos intracraneales";"";"";"";"";"4";""
"38.12";"Endarterectomía de otros vasos de cabeza y cuello";"";"";"";"";"4";""
"38.13";"Endarterectomía de vasos de miembros superiores";"";"";"";"";"4";""
"38.14";"Endarterectomía de aorta";"";"";"";"";"4";""
"38.15";"Endarterectomía de otros vasos toracicos";"";"";"";"";"4";""
"38.16";"Endarterectomía de arterias abdominales";"";"";"";"";"4";""
"38.18";"Endarterectomía de arterias de miembros inferiores";"";"";"";"";"4";""
"38.21";"Biopsia de vaso sanguineo";"";"";"";"";"4";""
"38.22";"Angioscopia percutánea";"";"";"";"";"4";""
"38.29";"Otros procedimientos diagnosticos sobre vasos sanguineos";"";"";"";"";"4";""
"38.30";"Resección con anastomosis de sitio no especificado";"";"";"";"";"4";""
"38.31";"Resección con anastomosis de vasos intracraneales";"";"";"";"";"4";""
"38.32";"Resección con anastomosis de otros vasos de cabeza y cuello";"";"";"";"";"4";""
"38.33";"Resección con anastomosis de vasos de miembros superiores";"";"";"";"";"4";""
"38.34";"Resección con anastomosis de aorta";"";"";"";"";"4";""
"38.35";"Resección con anastomosis de otros vasos toracicos";"";"";"";"";"4";""
"38.36";"Resección con anastomosis de arterias abdominales";"";"";"";"";"4";""
"38.37";"Resección con anastomosis de venas abdominales";"";"";"";"";"4";""
"38.38";"Resección con anastomosis de arterias de miembros inferiores";"";"";"";"";"4";""
"38.39";"Resección con anastomosis de venas de miembros inferiores";"";"";"";"";"4";""
"38.40";"Resección de vaso con sustitución de sitio no especificado";"";"";"";"";"4";""
"38.41";"Resección de vasos intracraneales con sustitución";"";"";"";"";"4";""
"38.42";"Resección de otros vasos de cabeza y cuello con sustitución";"";"";"";"";"4";""
"38.43";"Resección de vasos de miembros superiores con sustitución";"";"";"";"";"4";""
"38.44";"Resección de aorta, abdominal con sustitución";"";"";"";"";"4";""
"38.45";"Resección de vasos toracicos con sustitución";"";"";"";"";"4";""
"38.46";"Resección de arterias abdominales con sustitución";"";"";"";"";"4";""
"38.47";"Resección de venas abdominales con sustitución";"";"";"";"";"4";""
"38.48";"Resección de arterias de miembros inferiores con sustitución";"";"";"";"";"4";""
"38.49";"Resección de venas de miembros inferiores con sustitución";"";"";"";"";"4";""
"38.50";"Ligadura y extirpación de v. Varicosase sitio no especificad";"";"";"";"";"4";""
"38.51";"Ligadura y extirpación de vasos intracraneales";"";"";"";"";"4";""
"38.52";"Ligadura y extirpación de varices otro v. De cabeza y cuello";"";"";"";"";"4";""
"38.53";"Ligadura y extirpación de varices v. De miembros superiores";"";"";"";"";"4";""
"38.55";"Ligadura y extirpación de varices de otros vasos toracicos";"";"";"";"";"4";""
"38.57";"Ligadura y extirpación de venas abdominales";"";"";"";"";"4";""
"38.59";"Ligadura y extirpación de varices v. De miembros inferiore";"";"";"";"";"4";""
"38.60";"Otra escisión de vasos de sitio no especificado";"";"";"";"";"4";""
"38.61";"Otra escisión de vasos intracraneales";"";"";"";"";"4";""
"38.62";"Otra escisión de otros vasos de cabeza y cuello";"";"";"";"";"4";""
"38.63";"Otra escisión de vasos de miembros superiores";"";"";"";"";"4";""
"38.64";"Otra escisión de aorta";"";"";"";"";"4";""
"38.65";"Otra escisión de otros vasos toracicos";"";"";"";"";"4";""
"38.66";"Otra escisión de arterias abdominales";"";"";"";"";"4";""
"38.67";"Otra escisión de venas abdominales";"";"";"";"";"4";""
"38.68";"Otra escisión de arterias de miembros inferiores";"";"";"";"";"4";""
"38.69";"Otra escisión de venas de miembros inferiores";"";"";"";"";"4";""
"38.70";"Plicatura de vena cava";"";"";"";"";"4";""
"38.80";"Otra oclusión quirurgica de vasos sitio no especificado";"";"";"";"";"4";""
"38.81";"Otra oclusión quirurgica de vasos intracraneales";"";"";"";"";"4";""
"38.82";"Otra oclusión quirurgica de otros vasos de cabeza y cuello";"";"";"";"";"4";""
"38.83";"Otra oclusión quirurgica de vasos de miembros superiores";"";"";"";"";"4";""
"38.84";"Otra oclusión quirurgica de aorta";"";"";"";"";"4";""
"38.85";"Otra oclusión quirurugica de otros vasos toracicos";"";"";"";"";"4";""
"38.86";"Otra oclusión quirurgica de arterias abdominales";"";"";"";"";"4";""
"38.87";"Otra oclusión quirurgica de venas abdominales";"";"";"";"";"4";""
"38.88";"Otra oclusión quirurgica de arterias de miembros inferiores";"";"";"";"";"4";""
"38.89";"Otra oclusión quirurgica de venas de miembros inferiores";"";"";"";"";"4";""
"38.91";"Cateterismo arterial";"";"";"";"";"4";""
"38.92";"Cateterismo de vena umbilical";"";"";"";"";"4";""
"38.93";"Otro cateterismo venoso ncoc";"";"";"";"";"4";""
"38.94";"Disección de vena periferica";"";"";"";"";"4";""
"38.95";"Cateterización venosa para dialisis renal";"";"";"";"";"4";""
"38.98";"Otra punción de arteria";"";"";"";"";"4";""
"38.99";"Otra punción de vena";"";"";"";"";"4";""
"39.00";"Desviación o conexion de arteria sistemica a arteria pulmona";"";"";"";"";"4";""
"39.10";"Desviación venosa intraabdominal";"";"";"";"";"4";""
"39.21";"Anastomosis de vena cava-arteria pulmonar";"";"";"";"";"4";""
"39.22";"Derivación aorta-subclavia-carotidea";"";"";"";"";"4";""
"39.23";"Otra derivación o desviación vascular intratoracica";"";"";"";"";"4";""
"39.24";"Derivación aorta-renal";"";"";"";"";"4";""
"39.25";"Derivación aorta-iliaca-femoral";"";"";"";"";"4";""
"39.26";"Otra derivación o desviación vascular intrabdominal";"";"";"";"";"4";""
"39.27";"Arteriovenostomía para dialisis renal";"";"";"";"";"4";""
"39.28";"Desviación vascular extracraneal-intracraneal";"";"";"";"";"4";""
"39.29";"Otra derivación o desviación vascular (periferica)";"";"";"";"";"4";""
"39.30";"Sutura de vaso sanguineo no especificado";"";"";"";"";"4";""
"39.31";"Sutura de arteria";"";"";"";"";"4";""
"39.32";"Sutura de vena";"";"";"";"";"4";""
"39.41";"Control de hemorragia despues de cirugia vascular";"";"";"";"";"4";""
"39.42";"Revisión de derivación arteriovenosa para dialisis renal";"";"";"";"";"4";""
"39.43";"Extracción de desviación arteriovenosa para dialisis renal";"";"";"";"";"4";""
"39.49";"Otra revisión de procedimiento vascular";"";"";"";"";"4";""
"39.50";"Angioplastia o aterectomía de vasos no coronarios";"";"";"";"";"4";""
"39.51";"Interrupción de aneurisma";"";"";"";"";"4";""
"39.52";"Otra reparación de aneurisma";"";"";"";"";"4";""
"39.53";"Reparación de fistula arteriovenosa";"";"";"";"";"4";""
"39.54";"Operación de re-entrada (aorta)";"";"";"";"";"4";""
"39.55";"Reimplantación de vaso renal aberrante";"";"";"";"";"4";""
"39.56";"Reparación de vaso sanguineo con injerto de parche de tejido";"";"";"";"";"4";""
"39.57";"Reparación de vaso sanguineo con injerto de parche sintetico";"";"";"";"";"4";""
"39.58";"Reparac. De vaso sangui.con tipo de injerto de parche no esp";"";"";"";"";"4";""
"39.59";"Otra reparación de vaso";"";"";"";"";"4";""
"39.61";"Circulación extracorporea auxiliar para cirugia cardiaca abi";"";"";"";"";"4";""
"39.62";"Hipotermia (sistemica) accesoria de cirugia cardiaca abierta";"";"";"";"";"4";""
"39.63";"Cardioplegia";"";"";"";"";"4";""
"39.64";"Marcapasos cardiaco intraoperatorio";"";"";"";"";"4";""
"39.65";"Oxigenación extracorporea de la membrana";"";"";"";"";"4";""
"39.66";"Desviación cardiopulmonar percutánea";"";"";"";"";"4";""
"39.71";"Implante endovascular de injerto en aorta abdominal";"";"";"";"";"4";""
"39.79";"Otra reparación con injerto endovascular de aneurisma";"";"";"";"";"4";""
"39.80";"Operaciones sobre cuerpo carotideo y otros cuerpos vasculare";"";"";"";"";"4";""
"39.90";"Inserción de stent(s) de arteria no coronaria";"";"";"";"";"4";""
"39.91";"Liberación de vaso";"";"";"";"";"4";""
"39.92";"Inyección de agente esclerosante en vena";"";"";"";"";"4";""
"39.93";"Inserción de canula de vaso a vaso";"";"";"";"";"4";""
"39.94";"Sustitución de canula vaso a vaso";"";"";"";"";"4";""
"39.95";"Hemodialisis";"";"";"";"";"4";""
"39.96";"Perfusión de cuerpo entero";"";"";"";"";"4";""
"39.97";"Otra perfusión";"";"";"";"";"4";""
"39.98";"Control de hemorragia, n. E. O. M.";"";"";"";"";"4";""
"39.99";"Otras operaciones sobre vasos";"";"";"";"";"4";""
"40.00";"Incisión de estructuras linfaticas";"";"";"";"";"4";""
"40.11";"Biopsia de estructura linfatica";"";"";"";"";"4";""
"40.19";"Otros procedimientos diagnosticos sobre estructuras linfatic";"";"";"";"";"4";""
"40.21";"Escisión de nodulo linfatico cervical profundo";"";"";"";"";"4";""
"40.22";"Escisión de nodulo linfatico mamario interno";"";"";"";"";"4";""
"40.23";"Escisión de nodulo linfatico axilar";"";"";"";"";"4";""
"40.24";"Escisión de nodulo linfatico inguinal";"";"";"";"";"4";""
"40.29";"Escisión simple de otra estructutura linfatica";"";"";"";"";"4";""
"40.30";"Escisión de nodulo linfatico regional";"";"";"";"";"4";""
"40.40";"Disección radical de cuello, n. E. O. M.";"";"";"";"";"4";""
"40.41";"Disección radical de cuello, unilateral";"";"";"";"";"4";""
"40.42";"Disección radical de cuello, bilateral";"";"";"";"";"4";""
