"82.53";"Refijación de tendon de mano";"";"";"";"";"4";""
"82.54";"Refijación de musculo de mano";"";"";"";"";"4";""
"82.55";"Otro cambio de longitud de musculo o tendon de mano";"";"";"";"";"4";""
"82.56";"Otra transferencia o trasplante de tendon de mano";"";"";"";"";"4";""
"82.57";"Otra transposición de tendon de mano";"";"";"";"";"4";""
"82.58";"Otra transferencia o trasplante de musculo de mano";"";"";"";"";"4";""
"82.59";"Otra trasposición de musculo de mano";"";"";"";"";"4";""
"82.61";"Oper.de policización con transferencia de nervios y transfu";"";"";"";"";"4";""
"82.69";"Otra reconstrucción de dedo pulgar";"";"";"";"";"4";""
"82.71";"Reconstrucción de polea de tendon";"";"";"";"";"4";""
"82.72";"Operación plastica sobre mano con injerto de musculo o fasci";"";"";"";"";"4";""
"82.79";"Operación plastica sobre mano con injerto o implantación";"";"";"";"";"4";""
"82.81";"Transferencia de dedo, salvo pulgar";"";"";"";"";"4";""
"82.82";"Reparación de mano hendida";"";"";"";"";"4";""
"82.83";"Reparación de macrodactilia";"";"";"";"";"4";""
"82.84";"Reparación de dedo en martillo de la mano";"";"";"";"";"4";""
"82.85";"Otra tenodesis de mano";"";"";"";"";"4";""
"82.86";"Otra tenoplastia de mano";"";"";"";"";"4";""
"82.89";"Otras operaciones plasticas sobre mano";"";"";"";"";"4";""
"82.91";"Lisis de adhesiones de mano";"";"";"";"";"4";""
"82.92";"Aspiración de bolsa sinovial de mano";"";"";"";"";"4";""
"82.93";"Aspiración de otro tejido blando de mano";"";"";"";"";"4";""
"82.94";"Inyección de sustancia terapeutica en bolsa sinovial de mano";"";"";"";"";"4";""
"82.95";"Inyección de otra sustancia terapeutica en tendon de mano";"";"";"";"";"4";""
"82.96";"Otra inyecc.de sust.terapeut.de acc.local en tej.blando mano";"";"";"";"";"4";""
"82.99";"Otras operaciones sobre musculo, tendon y fascia de mano";"";"";"";"";"4";""
"83.01";"Exploración de vaina de tendon";"";"";"";"";"4";""
"83.02";"Miotomía";"";"";"";"";"4";""
"83.03";"Bursotomía";"";"";"";"";"4";""
"83.09";"Otra incisión de tejido blando";"";"";"";"";"4";""
"83.11";"Aquiletenotomía";"";"";"";"";"4";""
"83.12";"Tenotomía de tendon aductor de cadera";"";"";"";"";"4";""
"83.13";"Otra tenotomía";"";"";"";"";"4";""
"83.14";"Fasciotomía";"";"";"";"";"4";""
"83.19";"Otra división de tejido blando";"";"";"";"";"4";""
"83.21";"Biopsia de tejido blando";"";"";"";"";"4";""
"83.29";"Otros proc.diag.sobre musc.tendon,fascia,b.sinovial,y mano";"";"";"";"";"4";""
"83.31";"Escisión de lesión de vaina de tendon";"";"";"";"";"4";""
"83.32";"Escisión de lesión de musculo";"";"";"";"";"4";""
"83.39";"Escisión de lesión de otro tejido blando";"";"";"";"";"4";""
"83.41";"Escisión de tendon para injerto";"";"";"";"";"4";""
"83.42";"Otra tenotomía";"";"";"";"";"4";""
"83.43";"Escisión de musculo o fascia para injerto";"";"";"";"";"4";""
"83.44";"Otra fasciectomía";"";"";"";"";"4";""
"83.45";"Otra miectomía";"";"";"";"";"4";""
"83.49";"Otra escisión de tejido blando";"";"";"";"";"4";""
"83.50";"Bursectomía";"";"";"";"";"4";""
"83.61";"Sutura de vaina de tendon";"";"";"";"";"4";""
"83.62";"Sutura retardada de tendon";"";"";"";"";"4";""
"83.63";"Reparación de manguito de los rotadores";"";"";"";"";"4";""
"83.64";"Otra sutura de tendon";"";"";"";"";"4";""
"83.65";"Otra sutura de musculo o fascia";"";"";"";"";"4";""
"83.71";"Adelantamiento de tendon";"";"";"";"";"4";""
"83.72";"Recesión de tendon";"";"";"";"";"4";""
"83.73";"Refijación de tendon";"";"";"";"";"4";""
"83.74";"Refijación de musculo";"";"";"";"";"4";""
"83.75";"Transferencia o trasplante de tendon";"";"";"";"";"4";""
"83.76";"Otra trasposición de tendon";"";"";"";"";"4";""
"83.77";"Transferencia o trasplante de musculo";"";"";"";"";"4";""
"83.79";"Otra trasposición de musculo";"";"";"";"";"4";""
"83.81";"Injerto de tendon";"";"";"";"";"4";""
"83.82";"Injerto de musculo o fascia";"";"";"";"";"4";""
"83.83";"Reconstrución de polea de tendon";"";"";"";"";"4";""
"83.84";"Liberación de pie talo no clasificada bajo otro concepto";"";"";"";"";"4";""
"83.85";"Otro cambio en longitud de musculo o tendon";"";"";"";"";"4";""
"83.86";"Plastia de cuadriceps";"";"";"";"";"4";""
"83.87";"Otras operaciones plasticas sobre musculo";"";"";"";"";"4";""
"83.88";"Otras operciones plasticas sobre tendon";"";"";"";"";"4";""
"83.89";"Otras operaciones plasticas sobre fascia";"";"";"";"";"4";""
"83.91";"Lisis de adhesiones de musculo, tendon, fascia y bolsa sinov";"";"";"";"";"4";""
"83.92";"Inserción o sustitución de estimulador de musculo esqueletic";"";"";"";"";"4";""
"83.93";"Extracción de estimulador de musculo esqueletico";"";"";"";"";"4";""
"83.94";"Aspiración de bolsa sinovial";"";"";"";"";"4";""
"83.95";"Aspiración de otro tejido blando";"";"";"";"";"4";""
"83.96";"Inyeción de sustancia terapeutica en bolsa sinovial";"";"";"";"";"4";""
"83.97";"Inyección de sustancia terapeutica en tendon";"";"";"";"";"4";""
"83.98";"Inyecc.de sustanc.terapeut.de ación local en otro tejido bla";"";"";"";"";"4";""
"83.99";"Otras operaciones sobre musculo,tendon,fascia y bolsa sinovi";"";"";"";"";"4";""
"84.00";"Amputación de miembro superior, n. E. O. M.";"";"";"";"";"4";""
"84.01";"Amputación y desarticulación de dedo de mano";"";"";"";"";"4";""
"84.02";"Amputación y desarticulación de dedo pulgar";"";"";"";"";"4";""
"84.03";"Amputación a traves de mano";"";"";"";"";"4";""
"84.04";"Desarticulación de muñeca";"";"";"";"";"4";""
"84.05";"Amputación a traves de antebrazo";"";"";"";"";"4";""
"84.06";"Desarticulación de codo";"";"";"";"";"4";""
"84.07";"Amputación a traves de humero";"";"";"";"";"4";""
"84.08";"Desarticulación de hombro";"";"";"";"";"4";""
"84.09";"Amputación inter-toraco-escapular";"";"";"";"";"4";""
"84.10";"Amputación de miembro inferior, n. E. O. M.";"";"";"";"";"4";""
"84.11";"Amputación de dedo de pie";"";"";"";"";"4";""
"84.12";"Amputación a traves de pie";"";"";"";"";"4";""
"84.13";"Desarticulación de tobillo";"";"";"";"";"4";""
"84.14";"Amputación de tobillo a traves de maleolos de tibia y perone";"";"";"";"";"4";""
"84.15";"Otra amputación debajo de la rodilla";"";"";"";"";"4";""
"84.16";"Desarticulación de rodilla";"";"";"";"";"4";""
"84.17";"Amputación por encima de la rodilla";"";"";"";"";"4";""
"84.18";"Desarticulación de cadera";"";"";"";"";"4";""
"84.19";"Amputación abdominopelvica";"";"";"";"";"4";""
"84.21";"Refijación de dedo pulgar";"";"";"";"";"4";""
"84.22";"Refijación de dedo de mano";"";"";"";"";"4";""
"84.23";"Refijación de antebrazo, muñeca o mano";"";"";"";"";"4";""
"84.24";"Refijación de brazo superior";"";"";"";"";"4";""
"84.25";"Refijación de dedo de pie";"";"";"";"";"4";""
"84.26";"Refijación de pie";"";"";"";"";"4";""
"84.27";"Refijación de pierna inferior o tobillo";"";"";"";"";"4";""
"84.28";"Refijación de muslo";"";"";"";"";"4";""
"84.29";"Otra refijación";"";"";"";"";"4";""
"84.30";"Revisión de muñon de amputación";"";"";"";"";"4";""
"84.40";"Implantac.o colocac.de dispositivo de miembro protesico,n.e.";"";"";"";"";"4";""
"84.41";"Colocación de prótesis de brazo superior y hombro";"";"";"";"";"4";""
"84.42";"Colocación de prótesis de brazo inferior y mano";"";"";"";"";"4";""
"84.43";"Colocación de prótesis de brazo, n. E. O. M.";"";"";"";"";"4";""
"84.44";"Implantación de dispositivo protesico de brazo";"";"";"";"";"4";""
"84.45";"Colocación de prótesis encima de la rodilla";"";"";"";"";"4";""
"84.46";"Colocación de prótesis debajo de la rodilla";"";"";"";"";"4";""
"84.47";"Colocación de prótesis de pierna, n. E. O. M.";"";"";"";"";"4";""
"84.48";"Implantación de dispositivo protesico de pierna";"";"";"";"";"4";""
"84.91";"Amputación, n. E. O. M.";"";"";"";"";"4";""
"84.92";"Separación de gemelos unidos iguales";"";"";"";"";"4";""
"84.93";"Separación de gemelos unidos desiguales";"";"";"";"";"4";""
"84.99";"Otra operación sobre aparato musculoesqueletico ncoc";"";"";"";"";"4";""
"85.00";"Mastotomía";"";"";"";"";"4";""
"85.11";"Biopsia percutánea [aguja] cerrada de mama";"";"";"";"";"4";""
"85.12";"Biopsia abierta de mama";"";"";"";"";"4";""
"85.19";"Otrs procedimientos diagnosticos sobre mama";"";"";"";"";"4";""
"85.20";"Escisión o destrucción de tejido de mama, n. E. O. M.";"";"";"";"";"4";""
"85.21";"Escisión local de lesión de mama";"";"";"";"";"4";""
"85.22";"Resección de cuadrante de mama";"";"";"";"";"4";""
"85.23";"Mastectomía subtotal";"";"";"";"";"4";""
"85.24";"Escison de tejido mamario ectopico";"";"";"";"";"4";""
"85.25";"Escisión de pezon";"";"";"";"";"4";""
"85.31";"Mamoplastia de reducción unilateral";"";"";"";"";"4";""
"85.32";"Mamoplastia de reducción bilateral";"";"";"";"";"4";""
"85.33";"Mastectomía subcutánea unilateral con implantación simultane";"";"";"";"";"4";""
"85.34";"Otra mastectomía subcutánea unilateral";"";"";"";"";"4";""
"85.35";"Mastectomía subcutánea bilateral con implantación simultanea";"";"";"";"";"4";""
"85.36";"Otra mastectomía subcutánea bilateral";"";"";"";"";"4";""
"85.41";"Mastectomía simple unilateral";"";"";"";"";"4";""
"85.42";"Mastectomía simple bilateral";"";"";"";"";"4";""
"85.43";"Mastectomía simple extendida unilateral";"";"";"";"";"4";""
"85.44";"Mastectomía simple ampliada bilateral";"";"";"";"";"4";""
"85.45";"Mastectomía radical unilateral";"";"";"";"";"4";""
"85.46";"Mastectomía radical bilateral";"";"";"";"";"4";""
"85.47";"Mastectomía radical extendida unilateral";"";"";"";"";"4";""
"85.48";"Mastectomía radical ampliada bilateral";"";"";"";"";"4";""
"85.50";"Mamoplastia de aumento, n. E. O. M.";"";"";"";"";"4";""
"85.51";"Inyección de mama unilateral para aumento";"";"";"";"";"4";""
"85.52";"Inyección de mama bilateral para aumento";"";"";"";"";"4";""
"85.53";"Implante mamario unilateral";"";"";"";"";"4";""
"85.54";"Implante mamario bilateral";"";"";"";"";"4";""
"85.60";"Mastopexia";"";"";"";"";"4";""
"85.70";"Reconstrucción total de mama";"";"";"";"";"4";""
"85.81";"Sutura de herida de la mama";"";"";"";"";"4";""
"85.82";"Injerto de grosor parcial en la piel de la mama";"";"";"";"";"4";""
"85.83";"Injerto de grosor total en la piel de la mama";"";"";"";"";"4";""
"85.84";"Colgajo sobre la mama";"";"";"";"";"4";""
"85.85";"Colgajo muscular sobre region mamaria";"";"";"";"";"4";""
"85.86";"Trasposición de pezon";"";"";"";"";"4";""
"85.87";"Otra reparación o reconstrucción de pezon";"";"";"";"";"4";""
"85.89";"Otra mamoplastia";"";"";"";"";"4";""
"85.91";"Aspiración de mama";"";"";"";"";"4";""
"85.92";"Inyección de agente terapeutico en mama";"";"";"";"";"4";""
"85.93";"Revisión de implante de mama";"";"";"";"";"4";""
"85.94";"Extracción de implante de mama";"";"";"";"";"4";""
"85.95";"Inserción de expansor del tejido mamario";"";"";"";"";"4";""
"85.96";"Extracción de expansor de tejido mamario";"";"";"";"";"4";""
"85.99";"Otra operación sobre mama ncoc";"";"";"";"";"4";""
"86.01";"Aspiración de piel y tejido subcutaneo";"";"";"";"";"4";""
"86.02";"Inyección o tatuaje de lesión o defecto de la piel";"";"";"";"";"4";""
"86.03";"Incisión de seno o quiste pilonidal";"";"";"";"";"4";""
"86.04";"Otra incisión con drenaje de piel y tejido subcutaneo";"";"";"";"";"4";""
"86.05";"Incisión con extracc. De cuerpo extraño de piel y tejido sub";"";"";"";"";"4";""
"86.06";"Inserción de bomba infusora totalmente implantable";"";"";"";"";"4";""
"86.07";"Inserción dispositivo de acceso vascular totalm. Implantable";"";"";"";"";"4";""
"86.09";"Otra incisión de piel y tejido subcutaneo";"";"";"";"";"4";""
"86.11";"Biopsia de piel y tejido subcutaneo";"";"";"";"";"4";""
"86.19";"Otros proc. Diagn. Sobre piel y tejido subcutaneo";"";"";"";"";"4";""
"86.21";"Escisión de quiste o seno pilonidal";"";"";"";"";"4";""
"86.22";"Desbridamiento escisional de herida, infección o quemadura";"";"";"";"";"4";""
"86.23";"Extracción de uña, lecho de uña o pliegue de uña";"";"";"";"";"4";""
"86.24";"Quimiocirugia de piel";"";"";"";"";"4";""
"86.25";"Abrasión dermica";"";"";"";"";"4";""
"86.26";"Ligadura de apendice dermico";"";"";"";"";"4";""
"86.27";"Desbridamiento de uña, base de uña o pliegue de uña";"";"";"";"";"4";""
"86.28";"Desbridamiento no escisional de herida, infección o quemadur";"";"";"";"";"4";""
"86.30";"Otra escis.local o destr. Lesión o tejido de piel y t.subcut";"";"";"";"";"4";""
"86.40";"Escisión radical de lesión cutánea";"";"";"";"";"4";""
"86.51";"Reimplantación de cuero cabelludo";"";"";"";"";"4";""
"86.59";"Sutura de piel y tejido subcutaneo de otros sitios";"";"";"";"";"4";""
"86.60";"Injerto cutaneo libre, n. E. O. M.";"";"";"";"";"4";""
"86.61";"Injerto cutaneo de grosor total a mano";"";"";"";"";"4";""
"86.62";"Otro injerto cutaneo a mano";"";"";"";"";"4";""
"86.63";"Injerto cutaneo de grosor total a otros sitios";"";"";"";"";"4";""
"86.64";"Trasplante de pelo";"";"";"";"";"4";""
"86.65";"Heteroinjerto a piel";"";"";"";"";"4";""
"86.66";"Homoinjerto a piel";"";"";"";"";"4";""
"86.67";"Injerto regenerativo de piel";"";"";"";"";"4";""
"86.69";"Otro injerto cutaneo a otros sitios";"";"";"";"";"4";""
"86.70";"Injerto de pediculo o colgajo, n. E. O. M.";"";"";"";"";"4";""
"86.71";"Corte y preparación de injertos de pediculos o colgajos";"";"";"";"";"4";""
"86.72";"Avance de injerto de pediculo o colgajo a mano";"";"";"";"";"4";""
"86.73";"Fijación de injerto de pediculo o colgajo a mano";"";"";"";"";"4";""
"86.74";"Fijación de injerto de pediculo o colgajo a otros sitios";"";"";"";"";"4";""
"86.75";"Revisión de injerto de pediculo o colgajo";"";"";"";"";"4";""
"86.81";"Reparación de debilidad facial";"";"";"";"";"4";""
"86.82";"Ritidectomía facial";"";"";"";"";"4";""
"86.83";"Operación plastica de reducción de tamaño";"";"";"";"";"4";""
"86.84";"Relajación de cicatriz o de contractura reticulada de piel";"";"";"";"";"4";""
"86.85";"Corrección de sindactilia";"";"";"";"";"4";""
"86.86";"Onicoplastia";"";"";"";"";"4";""
"86.89";"Otra reparación y reconstrucción de piel y tejido subcutaneo";"";"";"";"";"4";""
"86.91";"Escisión de piel para injerto";"";"";"";"";"4";""
"86.92";"Electrolisis y otra depilación de piel";"";"";"";"";"4";""
"86.93";"Inserción de expansor de tejido";"";"";"";"";"4";""
"86.99";"Otra operación sobre piel y tejido subcutaneo ncoc";"";"";"";"";"4";""
"87.01";"Neumoencefalograma";"";"";"";"";"4";""
"87.02";"Otras radiografias de contraste de cerebro y craneo";"";"";"";"";"4";""
"87.03";"Tomografia axial computerizada de cabeza";"";"";"";"";"4";""
"87.04";"Otra tomografia de cabeza";"";"";"";"";"4";""
"87.05";"Dacriocistografia de contraste";"";"";"";"";"4";""
"87.06";"Radiografia de contraste de nasofaringe";"";"";"";"";"4";""
"87.07";"Laringografia de contraste";"";"";"";"";"4";""
"87.08";"Linfagiografia cervical";"";"";"";"";"4";""
"87.09";"Otra radiografia de tejido blando de cara,cabeza y cuello";"";"";"";"";"4";""
"87.11";"Radiografia dental de boca entera";"";"";"";"";"4";""
"87.12";"Otra radiografia dental";"";"";"";"";"4";""
"87.13";"Artrografia de contraste temporomandibular";"";"";"";"";"4";""
"87.14";"Radiografia de contraste de orbita";"";"";"";"";"4";""
"87.15";"Radiografia de contraste de seno";"";"";"";"";"4";""
"87.16";"Otra radiografia de huesos faciales";"";"";"";"";"4";""
"87.17";"Otra radiografia de craneo";"";"";"";"";"4";""
"87.21";"Mielografia de contraste";"";"";"";"";"4";""
"87.22";"Otra radiografia de columna cervical";"";"";"";"";"4";""
"87.23";"Otra radiografia de columna toracica";"";"";"";"";"4";""
"87.24";"Otra radiografia de columna lumbosacra";"";"";"";"";"4";""
"87.29";"Otra radiografia de columna vertebral";"";"";"";"";"4";""
"87.31";"Broncografia endotraqueal";"";"";"";"";"4";""
"87.32";"Otra broncografia de contraste";"";"";"";"";"4";""
"87.33";"Neumografia mediastinica";"";"";"";"";"4";""
"87.34";"Linfangiografia intratoracica";"";"";"";"";"4";""
"87.35";"Radiografia de contraste de conductos mamarios";"";"";"";"";"4";""
"87.36";"Xerografia de mama";"";"";"";"";"4";""
"87.37";"Otra mamografia";"";"";"";"";"4";""
"87.38";"Sinografia de pared toracica";"";"";"";"";"4";""
"87.39";"Otra radiografia de tejidos blandos de pared toracica";"";"";"";"";"4";""
"87.41";"Tomografia axial computerizada de torax";"";"";"";"";"4";""
"87.42";"Otra tomografia de torax";"";"";"";"";"4";""
"87.43";"Radiografia de costillas, esternon y clavicula";"";"";"";"";"4";""
"87.44";"Radiografia toracica rutinaria, descrita como tal";"";"";"";"";"4";""
"87.49";"Otra radiografia toracica";"";"";"";"";"4";""
"87.51";"Colangiografia hepatica percutánea";"";"";"";"";"4";""
"87.52";"Colangiografia intravenosa";"";"";"";"";"4";""
"87.53";"Colangiografia intraoperatoria";"";"";"";"";"4";""
"87.54";"Otra colangiografia";"";"";"";"";"4";""
"87.59";"Otra radiografia del tracto biliar";"";"";"";"";"4";""
"87.61";"Trago de papilla";"";"";"";"";"4";""
"87.62";"Transito esofago-gastro-intestinal";"";"";"";"";"4";""
"87.63";"Serie de intestino delgado";"";"";"";"";"4";""
"87.64";"Serie de intestino grueso (enema opaco)";"";"";"";"";"4";""
"87.65";"Otra radiografia de intestino";"";"";"";"";"4";""
"87.66";"Pancreatografia de contraste";"";"";"";"";"4";""
"87.69";"Otra radiografia del tracto digestivo";"";"";"";"";"4";""
"87.71";"Tomografia axial computerizada de riñon";"";"";"";"";"4";""
"87.72";"Otra nefrotomografia";"";"";"";"";"4";""
"87.73";"Pielografia intravenosa";"";"";"";"";"4";""
"87.74";"Pielografia retrograda";"";"";"";"";"4";""
"87.75";"Pielografia percutánea";"";"";"";"";"4";""
"87.76";"Cistouretrografia retrograda";"";"";"";"";"4";""
"87.77";"Otra cistografia";"";"";"";"";"4";""
"87.78";"Conductografia ileal";"";"";"";"";"4";""
"87.79";"Otra radiografia del aparato urinario";"";"";"";"";"4";""
"87.81";"Radiografia de utero gravido";"";"";"";"";"4";""
"87.82";"Histerosalpingografia de contraste por gas";"";"";"";"";"4";""
"87.83";"Histerosalpingografia con contrate radiopaco";"";"";"";"";"4";""
"87.84";"Histerografia percutánea";"";"";"";"";"4";""
"87.85";"Otra radiografia de trompas de falopio y utero";"";"";"";"";"4";""
"87.89";"Otra radiografia de organos genitales femeninos";"";"";"";"";"4";""
"87.91";"Radiografia de contraste de vesiculas seminales";"";"";"";"";"4";""
"87.92";"Otra radiografia de prostata y vesiculas seminales";"";"";"";"";"4";""
"87.93";"Epididimografia de contraste";"";"";"";"";"4";""
"87.94";"Vasografia de contraste (deferentografia)";"";"";"";"";"4";""
"87.95";"Otra radiografia de epididimo y conductos deferentes";"";"";"";"";"4";""
"87.99";"Otra radiografia de organos genitales masculinos";"";"";"";"";"4";""
"88.01";"Tomografia axial computerizada de abdomen";"";"";"";"";"4";""
"88.02";"Otra tomografia de abdomen";"";"";"";"";"4";""
"88.03";"Sinografia de pared abdominal";"";"";"";"";"4";""
"88.04";"Linfangiografia abdominal";"";"";"";"";"4";""
"88.09";"Otra radiografia de tejidos blandos de pared abdominal";"";"";"";"";"4";""
"88.11";"Radiografia pelvica de contraste por contraste opaco";"";"";"";"";"4";""
"88.12";"Radiografia pelvica de contrate por gas";"";"";"";"";"4";""
"88.13";"Otra neumografia peritoneal";"";"";"";"";"4";""
"88.14";"Fistulografia retroperitoneal";"";"";"";"";"4";""
"88.15";"Neumografia retroperitoneal";"";"";"";"";"4";""
"88.16";"Otra radiografia peritoneal";"";"";"";"";"4";""
"88.19";"Otra radiografia de abdomen";"";"";"";"";"4";""
"88.21";"Radiografia esqueletica de hombro y brazo superior";"";"";"";"";"4";""
"88.22";"Radiografia esqueletica de codo y antebrazo";"";"";"";"";"4";""
"88.23";"Radiografia esqueletica de muñeca y mano";"";"";"";"";"4";""
"88.24";"Radiografia esqueletica de miembro superior, n. E .o. M.";"";"";"";"";"4";""
"88.25";"Pelvimertia";"";"";"";"";"4";""
"88.26";"Otra radiografia esqueletica de pelvis y cadera";"";"";"";"";"4";""
"88.27";"Radiografia esqueletica de muslo, rodillas y pierna inferior";"";"";"";"";"4";""
"88.28";"Radiografia esqueletica de tobillo y pie";"";"";"";"";"4";""
"88.29";"Radiografia esqueletica de miembro inferior, n. E .o . M.";"";"";"";"";"4";""
"88.31";"Serie esqueletica";"";"";"";"";"4";""
"88.32";"Artrografia de contraste";"";"";"";"";"4";""
"88.33";"Otra radiografia esqueletica";"";"";"";"";"4";""
"88.34";"Linfangiografia de miembro superior";"";"";"";"";"4";""
"88.35";"Otra radiografia de tejidos blandos de miembro superior";"";"";"";"";"4";""
"88.36";"Linfangiografia de miembro inferior";"";"";"";"";"4";""
"88.37";"Otra radiografia de tejidos blandos de miembro inferior";"";"";"";"";"4";""
"88.38";"Otra tomografia axial computerizada";"";"";"";"";"4";""
"88.39";"Radiografia, otra y no especificada";"";"";"";"";"4";""
"88.40";"Arteriografia con empleo de material de contraste,sitio no e";"";"";"";"";"4";""
"88.41";"Arteriografia de arterias cerebrales";"";"";"";"";"4";""
"88.42";"Aortografia";"";"";"";"";"4";""
"88.43";"Arteriografia de arterias pulmonares";"";"";"";"";"4";""
"88.44";"Arteriografia de otros vasos intratoracicos";"";"";"";"";"4";""
"88.45";"Arteriografia de arterias renales";"";"";"";"";"4";""
"88.46";"Arteriografia de placenta";"";"";"";"";"4";""
"88.47";"Arteriografia de otras arterias intra-abdominales";"";"";"";"";"4";""
"88.48";"Arteriog. De arterias femorales y otras art. De extre.inf.";"";"";"";"";"4";""
"88.49";"Arteriografia de otros sitios especificados";"";"";"";"";"4";""
"88.50";"Angiocardiografia, n. E. O. M.";"";"";"";"";"4";""
"88.51";"Angiocardiografia de venas cavas";"";"";"";"";"4";""
"88.52";"Angiocardiografia de estructuras cardiacas derechas";"";"";"";"";"4";""
"88.53";"Angiocardiografia de estructuras cardiacas izquierdas";"";"";"";"";"4";""
"88.54";"Angiocardiografia combinada del corazon derecho e izquierdo";"";"";"";"";"4";""
"88.55";"Arteriografia coronaria con empleo de un solo cateter";"";"";"";"";"4";""
"88.56";"Arteriografia corornaria con empleo de dos cateteres";"";"";"";"";"4";""
"88.57";"Otra arteriografia coronaria y artergr.coronaria no especifi";"";"";"";"";"4";""
"88.58";"Roentgenografia cardiaca de contraste negativo";"";"";"";"";"4";""
"88.60";"Flebografia con empleo de material de contraste,sitio no esp";"";"";"";"";"4";""
"88.61";"Flebogrf.de v.de cabeza y cuello con empleo de mater.d.contr";"";"";"";"";"4";""
"88.62";"Flebografia de v.pulmonares con empleo de material de contra";"";"";"";"";"4";""
"88.63";"Flebogrf.de otras v.intratora. Con empleo de mater.de contra";"";"";"";"";"4";""
"88.64";"Flebogrf.del sistema de v.prota con empleo de mater.de contr";"";"";"";"";"4";""
"88.65";"Flebogrf.de otras v.intrabdomin.con empleo de mater.de contr";"";"";"";"";"4";""
"88.66";"Fleb.de v. Femorales y otras v.de m.m.i.i.con emp.ma.de cont";"";"";"";"";"4";""
"88.67";"Flebografia de otros sitios especific. Con empleo de mat.d.c";"";"";"";"";"4";""
"88.68";"Flebografia de impedancia";"";"";"";"";"4";""
"88.71";"Ultrasonidos diagnosticos de cabeza y cuello";"";"";"";"";"4";""
"88.72";"Ultrasonidos diagnosticos de corazon";"";"";"";"";"4";""
"88.73";"Ultrasonidos diagnosticos de otros sitios toracicos";"";"";"";"";"4";""
"88.74";"Ultrasonidos diagnosticos de aparato digestivo";"";"";"";"";"4";""
"88.75";"Ultrasonidos diagnosticos de aparato urinario";"";"";"";"";"4";""
"88.76";"Ultrasonidos diagnosticos de abdomen y retroperitoneo";"";"";"";"";"4";""
"88.77";"Ultrasonidos diagnosticos del sistema vascular periferico";"";"";"";"";"4";""
"88.78";"Ultrasonidos diagnosticos de utero gravido";"";"";"";"";"4";""
"88.79";"Otros ultrasonidos diagnosticos";"";"";"";"";"4";""
"88.81";"Termografia cerebral";"";"";"";"";"4";""
"88.82";"Termografia ocular";"";"";"";"";"4";""
"88.83";"Termografia de hueso";"";"";"";"";"4";""
"88.84";"Termografia de musculo";"";"";"";"";"4";""
"88.85";"Termografia de mama";"";"";"";"";"4";""
"88.86";"Termografia de vaso sanguineo";"";"";"";"";"4";""
"88.89";"Termografia de otros sitios";"";"";"";"";"4";""
"88.90";"Diagnostico por imagenes, no clasificado de otro modo";"";"";"";"";"4";""
"88.91";"Imagenes de resonancia magnetica de cerebro y tronco cerebra";"";"";"";"";"4";""
"88.92";"Imagenes de resonancia magnetica de torax y miocardio";"";"";"";"";"4";""
"88.93";"Imagenes de resonancia magnetica del canal espinal";"";"";"";"";"4";""
"88.94";"Imagenes de resonancia magnetica del sistema musculoesquelet";"";"";"";"";"4";""
"88.95";"Imagenes de resonancia magnetica de pelvis, prostata y vejig";"";"";"";"";"4";""
"88.97";"Resonancia magnetica nuclear de otros sitios especificados";"";"";"";"";"4";""
"88.98";"Estudio de la densidad mineral osea";"";"";"";"";"4";""
"89.01";"Entrevista y evaluación, descritas como breves";"";"";"";"";"4";""
"89.02";"Entrevista y evaluación, descritas como limitadas";"";"";"";"";"4";""
"89.03";"Entrevista y evaluación, descritas como globales";"";"";"";"";"4";""
"89.04";"Otra entrevista y evaluación";"";"";"";"";"4";""
"89.05";"Entrevista y evaluación diagnosticas, n. E. O. M.";"";"";"";"";"4";""
"89.06";"Consulta,descrita como limitada";"";"";"";"";"4";""
"89.07";"Consulta, descrita como global";"";"";"";"";"4";""
"89.08";"Otra consulta";"";"";"";"";"4";""
"89.09";"Consulta, n. E. O. M.";"";"";"";"";"4";""
"89.10";"Prueba del amobarbital intracarotido";"";"";"";"";"4";""
"89.11";"Tonometria";"";"";"";"";"4";""
"89.12";"Estudio de función nasal";"";"";"";"";"4";""
"89.13";"Examen neurologico";"";"";"";"";"4";""
"89.14";"Electroencefalograma";"";"";"";"";"4";""
"89.15";"Otras pruebas de funcionamiento neurologico no quirurgicas";"";"";"";"";"4";""
"89.16";"Transiluminación craneal de recien nacido";"";"";"";"";"4";""
"89.17";"Polisomnograma";"";"";"";"";"4";""
"89.18";"Otras pruebas funcionales del trastorno del sueño";"";"";"";"";"4";""
